{
  "$schema": "https://json-schema.org/draft/2020-12/schema",
  "$id": "https://raw.githubusercontent.com/Maferreira25/Aura-Code/main/schemas/protected-assurance-plane.schema.json",
  "title": "Aura Code Protected Assurance Plane Policy",
  "type": "object",
  "required": [
    "schema_version",
    "protected",
    "held_out",
    "append_only",
    "public_tests"
  ],
  "properties": {
    "schema_version": {"type": "string", "const": "1.0.0"},
    "protected": {
      "type": "array",
      "items": {"type": "string", "minLength": 1},
      "uniqueItems": true
    },
    "held_out": {
      "type": "array",
      "items": {"type": "string", "minLength": 1},
      "uniqueItems": true
    },
    "append_only": {
      "type": "array",
      "items": {"type": "string", "minLength": 1},
      "uniqueItems": true
    },
    "public_tests": {
      "type": "array",
      "items": {"type": "string", "minLength": 1},
      "uniqueItems": true
    }
  },
  "additionalProperties": false
}
